{"$schema":"https://json-schema.org/draft/2020-12/schema","$id":"task-request.schema.json","type":"object","additionalProperties":false,"required":["protocol_version","run_id","attempt_id","task_id","task_type","input","assets","budget"],"properties":{"protocol_version":{"const":"1.0"},"run_id":{"type":"string","minLength":1},"attempt_id":{"type":"string","minLength":1},"task_id":{"type":"string","minLength":1},"task_type":{"type":"string","pattern":"^[a-z][a-z0-9_.-]*\\.v[0-9]+$"},"input":{"type":"object"},"assets":{"type":"array","items":{"type":"object","additionalProperties":false,"required":["id","path"],"properties":{"id":{"type":"string","minLength":1},"path":{"type":"string","minLength":1},"media_type":{"type":"string"},"checksum":{"type":"string","pattern":"^sha256:[0-9a-f]{64}$"}}}},"budget":{"type":"object","additionalProperties":false,"required":["wall_time_seconds"],"properties":{"wall_time_seconds":{"type":"number","exclusiveMinimum":0},"model_calls":{"type":"integer","minimum":0},"tokens":{"type":"integer","minimum":0},"tool_calls":{"type":"integer","minimum":0}}},"seed":{"type":"integer"},"extensions":{"type":"object"}}}
