{"protocol_version":"1.0","run_id":"example","attempt_id":"attempt-0001","task_id":"egfr","task_type":"research.evidence_synthesis.v1","input":{"research_question":"What evidence links EGFR alterations to lung cancer therapy response?","background":"Focus on concise mechanistic evidence.","output_requirements":["Cite evidence identifiers."]},"assets":[],"budget":{"wall_time_seconds":60}}
